Key,Value
title,(Remote) Mobile App Software Test Engineer
company,Stryker
location,"Menlo Park, CA"
keywords,"['engineer', 'python', 'API']"
link,https://www.linkedin.com/jobs/search?keywords=Sqa%2BEngineer&location=Cupertino%2C%2BCalifornia%2C%2BUnited%2BStates&geoId=106758460&f_TPR=r604800&distance=25&currentJobId=3776021201&position=3&pageNum=0
description,"Why engineering at Stryker?

At Stryker we are dedicated to improving lives, with a passion for researching and developing new medical device products. As an engineer at Stryker, you will be proud of the work that you will be doing, using cutting-edge technologies to make healthcare better. Here, you will work in a supportive culture with other incredibly talented and intelligent people, creating industry-leading medical technology products. You will also have growth opportunities as we have a culture that supports your personal and professional development.

Need another reason to apply? Check out these 8 reasons to join Stryker's engineering team: https://www.strykercareersblog.com/post/8-reasons-to-join-strykers-engineering-team

We are proud to be named one of the World’s Best Workplaces and a Best Workplace for Diversity by Fortune Magazine! Learn more about our award-winning organization by visiting stryker.com

It's Time to Join Stryker!

In this role, you will work along with a team of software engineers develop and deploy iOS/Android based apps that tackle obstetric hemorrhage, retained sponges and inappropriate transfusions. See an overview here: Triton App Overview

This is a unique, high visibility opportunity for a someone who wants to make business impacts. In this role, you will bring your outstanding analytical abilities and desire to work with cross-functional teams and systems. You are a self-starter and able to learn on the go.

What You Will Do

Technical Responsibilities:

You will build and maintain scalable mobile test automation frameworks and supporting infrastructure for Mobile Native
You will be responsible for all automation and performance testing activities - planning, script design, test script generation/maintenance, performance test execution, report generation, results analysis, defect generation and following up for closure.
You will drive continual improvement of the automation and performance testing process at the team level.
You will contribute to developing and enhancing the automation framework as well as keeping it up to date with changes in functionality
You will apply performance testing tools and technologies to support the testing process and framework across an integrated Agile software development lifecycle.
You will participate in peer reviews of Test Engineers’ test designs and be self-directed in test case design, execution, results analysis and defect reporting.
You will interact with QA team, Developers and others for manual and automation test planning and implementation.
You will develop and execute maintainable automation tests for acceptance, functional, and regression test cases.

What You Need:

Bachelor's degree in Software Engineering / Computer Science or related discipline required
4+ years of related work experience required
2+ years of experience developing and executing automated test cases on mobile applications required
Experience with object-oriented programming languages (Swift, Objective-C, Kotlin, or Java) required

What We Would Love That You Have (Preferred):

Experience with testing and automating REST API
Experience with Mobile testing frameworks such as Appium, Espresso, XCUITest
Experience with at least one scripting language - VBScript, Pearl, Python, or Shell
Ability to lead strategies with tools for static/dynamic analysis, memory management, code coverage and techniques for analyzing software
Ability to lead integration and deployment processes
Regulatory and compliance standards applied to the SDLC (Software Development Life Cycle)
95,100 - $204,000 salary plus bonus eligible + Benefits (Health, Vision, Dental, 401K, Tuition Reimbursement, Employee Assistance Program, Wellbeing Program, Employee Stock Purchase Program). This information reflects the anticipated salary range for this position based on current national data. Actual minimum and maximum may vary based location. Individual pay is based on skills, experience, and other relevant factors.

About Stryker

Our benefits:

12 paid holidays annually
Health benefits include: Medical and prescription drug insurance, dental insurance, vision insurance, critical illness insurance, accident insurance, hospital indemnity insurance, personalized healthcare support, wellbeing program and tobacco cessation program.
Financial benefits include Health Savings Account (HSA), Flexible Spending Accounts (FSAs), 401(k) plan, Employee Stock Purchase Plan (ESPP), basic life and AD&D insurance, and short-term disability insurance.

For a more detailed overview of our benefits or time off, please follow this link to learn more: US Stryker employee benefits

About Stryker

Stryker is one of the world’s leading medical technology companies and, together with its customers, is driven to make healthcare better. The company offers innovative products and services in Medical and Surgical, Neurotechnology, Orthopaedics and Spine that help improve patient and healthcare outcomes. Alongside its customers around the world, Stryker impacts more than 130 million patients annually. More information is available at stryker.com.

Know someone at Stryker?

Be sure to have them submit you as a referral prior to applying for this position. Learn more about our employee referral program on our referral page

Stryker is driven to work together with our customers to make healthcare better. Employees and new hires in sales and field roles that require access to customer accounts as a function of the job may be required, depending on customer requirements, to obtain various vaccinations as an essential function of their role.

R496615"
